{
  "artifact_type": "public-environment-summary",
  "captured_at_utc": "2026-07-30T02:14:50Z",
  "limitations": [
    "Tool versions from one clean virtual machine; this summary does not establish RF or hardware compatibility."
  ],
  "release_version": "1.1.0",
  "schema_version": "1.0",
  "scope": "Clean Ubuntu 24.04 virtual-machine tool versions; not a scenario result.",
  "source_commit": "59471947da95783c1a85a4d18284360e4b6d898b",
  "tools": [
    {
      "name": "docker",
      "version": "29.1.3"
    },
    {
      "name": "docker-compose",
      "version": "2.40.3"
    },
    {
      "name": "node",
      "version": "18.19.1"
    },
    {
      "name": "npm",
      "version": "9.2.0"
    },
    {
      "name": "python",
      "version": "3.12.3"
    }
  ]
}
